{
  "name": "Priya Nair",
  "email": "priya.nair@shopmail.com",
  "issue_type": "delivery",
  "urgency": "high",
  "message": "Order #58291 has not arrived; it was expected last Tuesday and tracking has not updated in 5 days. The customer needs it urgently as it is a birthday gift needed by tomorrow."
}
